{
  "annotatie-id": "BWBR0004770/art9/lid1",
  "bwb-id": "BWBR0004770",
  "wet": "IW 1990",
  "artikel": "9",
  "lid": "1",
  "peildatum": "2026-01-01",
  "structuurpositie": "Hoofdstuk II Invordering in eerste aanleg > Artikel 9 > Lid 1",
  "wetstekst": "Een belastingaanslag is invorderbaar zes weken na de dagtekening van het aanslagbiljet.",
  "annotatierijen": [
    {
      "rij-id": "r-001",
      "markering": "Een belastingaanslag",
      "jas-klasse": "rechtsobject",
      "interpretatiemethode": "grammaticaal",
      "begrip-id": "BWBR0004770/art9/lid1/belastingaanslag",
      "toelichting-klasse": "",
      "signalering": null
    },
    {
      "rij-id": "r-002",
      "markering": "is invorderbaar",
      "jas-klasse": "rechtsbetrekking",
      "interpretatiemethode": "grammaticaal",
      "begrip-id": "BWBR0004770/art9/lid1/invorderbaarheid",
      "toelichting-klasse": "",
      "signalering": "⚠ rechtssubjecten (belastingschuldige, ontvanger) niet expliciet benoemd in lid 1; impliciet via art. 2 en 3 IW 1990"
    },
    {
      "rij-id": "r-003",
      "markering": "zes weken na de dagtekening van het aanslagbiljet",
      "jas-klasse": "voorwaarde",
      "interpretatiemethode": "grammaticaal",
      "begrip-id": "BWBR0004770/art9/lid1/zes-weken-na-dagtekening-aanslagbiljet",
      "toelichting-klasse": "",
      "signalering": null
    },
    {
      "rij-id": "r-004",
      "markering": "zes weken",
      "jas-klasse": "tijdsaanduiding",
      "interpretatiemethode": "grammaticaal",
      "begrip-id": "BWBR0004770/art9/lid1/zes-weken",
      "toelichting-klasse": "",
      "signalering": null
    },
    {
      "rij-id": "r-005",
      "markering": "de dagtekening van het aanslagbiljet",
      "jas-klasse": "tijdsaanduiding",
      "interpretatiemethode": "systematisch",
      "begrip-id": "BWBR0004770/art9/lid1/dagtekening-aanslagbiljet",
      "toelichting-klasse": "",
      "signalering": "⚠ dubbelclassificatie: ook rechtsfeit (nr. 6); dagtekening markeert zowel het aanvangstijdstip van de invorderingstermijn als het rechtsscheppende moment dat de termijn doet ingaan"
    },
    {
      "rij-id": "r-006",
      "markering": "de dagtekening van het aanslagbiljet",
      "jas-klasse": "rechtsfeit",
      "interpretatiemethode": "systematisch",
      "begrip-id": "BWBR0004770/art9/lid1/dagtekening-aanslagbiljet",
      "toelichting-klasse": "",
      "signalering": "⚠ hergebruik begrip-noot (zie nr. 5); als rechtsfeit: de dagtekening is de handeling waaraan het rechtsgevolg (aanvang invorderingstermijn) is verbonden"
    },
    {
      "rij-id": "r-007",
      "markering": "Een belastingaanslag is invorderbaar zes weken na de dagtekening van het aanslagbiljet.",
      "jas-klasse": "afleidingsregel",
      "interpretatiemethode": "systematisch",
      "begrip-id": "BWBR0004770/art9/lid1/invorderbaarheid-belastingaanslag",
      "toelichting-klasse": "",
      "signalering": null
    }
  ],
  "diagram": {
    "centrale-klasse": "rechtsbetrekking",
    "knopen": [
      {
        "id": "RF",
        "jas-klasse": "rechtsfeit",
        "label": "rechtsfeit 'dagtekening van het aanslagbiljet'",
        "begrip-id": null
      },
      {
        "id": "RB",
        "jas-klasse": "rechtsbetrekking",
        "label": "rechtsbetrekking 'invorderbaar'",
        "begrip-id": null
      },
      {
        "id": "RO",
        "jas-klasse": "rechtsobject",
        "label": "rechtsobject 'belastingaanslag'",
        "begrip-id": null
      },
      {
        "id": "VW",
        "jas-klasse": "voorwaarde",
        "label": "voorwaarde 'zes weken na de dagtekening…'",
        "begrip-id": null
      },
      {
        "id": "TA",
        "jas-klasse": "tijdsaanduiding",
        "label": "tijdsaanduiding 'zes weken'",
        "begrip-id": null
      },
      {
        "id": "AR",
        "jas-klasse": "afleidingsregel",
        "label": "afleidingsregel 'belastingaanslag invorderbaar zes…'",
        "begrip-id": null
      }
    ],
    "kanten": [
      {
        "van": "RF",
        "naar": "RB",
        "label": "triggert"
      },
      {
        "van": "RB",
        "naar": "RO",
        "label": "voorwerp"
      },
      {
        "van": "RB",
        "naar": "VW",
        "label": "geldig indien"
      },
      {
        "van": "RB",
        "naar": "AR",
        "label": "nader uitgewerkt in"
      },
      {
        "van": "VW",
        "naar": "TA",
        "label": null
      }
    ]
  },
  "kruisreferenties": []
}